{
  "schemaVersion": 1,
  "title": "Career Mission AI",
  "summary": "전공과 목표 직무를 바탕으로 미션, 제출 피드백, 포트폴리오 초안을 연결하는 커리어 준비 서비스입니다.",
  "githubUser": "samingming(정사임)",
  "thumbnail": "thumbnail.png",
  "screenshots": [
    "screenshots/mission.png",
    "screenshots/feedback.png",
    "screenshots/portfolio.png"
  ],
  "problem": "학생과 초기 구직자는 전공, 목표 직무, 자격증, 포트폴리오 준비를 각각 따로 관리하는 경우가 많습니다. 그 결과 무엇을 먼저 해야 하는지 알기 어렵고, 미션 결과물을 제출해도 피드백과 포트폴리오 초안으로 자연스럽게 이어지지 않습니다.",
  "targetUsers": [
    "전공과 목표 직무를 연결해 취업 준비를 시작하려는 대학생",
    "자격증과 프로젝트 결과물을 포트폴리오로 정리하려는 초기 구직자",
    "AI 피드백으로 제출 결과물을 빠르게 개선하고 싶은 사용자"
  ],
  "features": [
    "전공, 목표 직무, 보유 역량을 바탕으로 맞춤 미션을 추천합니다.",
    "미션 체크리스트 진행 상태를 저장하고 다시 조회합니다.",
    "결과물 링크와 텍스트, 코드, 이미지, PDF 파일을 제출하고 AI 피드백을 생성합니다.",
    "저장된 피드백을 바탕으로 포트폴리오 프로젝트 초안을 생성하고 조회합니다.",
    "학교, 전공, 직업, 자격증 검색을 백엔드 API와 캐시로 안정적으로 제공합니다."
  ],
  "featureTags": [
    "미션 추천",
    "AI 피드백",
    "포트폴리오"
  ],
  "techStack": [
    "React",
    "Vite",
    "Express",
    "Prisma",
    "PostgreSQL",
    "Supabase",
    "OpenAI API",
    "Node.js"
  ],
  "techHighlights": [
    "Prisma와 Supabase PostgreSQL로 사용자 스펙, 미션 진행률, 제출 결과, 피드백, 포트폴리오 초안을 저장합니다.",
    "OpenAI Responses API에 텍스트, 코드, 이미지, PDF 제출 근거를 전달해 사용자별 피드백을 생성합니다.",
    "외부 검색 API 결과에 서버 메모리 TTL 캐시를 적용해 학교, 전공, 직업, 자격증 검색 안정성을 높였습니다."
  ],
  "developmentWithAI": "저는 서비스 목표와 사용자 흐름을 정하고, 구현 후 브라우저와 테스트 결과를 확인했습니다. AI Agent는 기존 React와 Express 코드 구조를 읽고 API, Prisma 모델, 테스트, 문서, UI 수정을 제안하고 구현했습니다. 작업 중 무한 호출, Prisma migration drift, OpenAI PDF 입력 오류처럼 실제 실행에서 드러난 문제를 함께 추적해 수정했습니다.",
  "agent": {
    "summary": "Codex Agent와 프로젝트 전용 디자인/검증 흐름을 사용해 기획 문서, 백엔드 API, 프론트 화면, 테스트, 샘플 PDF까지 반복적으로 구현하고 확인했습니다.",
    "agentTools": [
      {
        "type": "agent",
        "name": "Codex 개발 Agent",
        "purpose": "기존 코드베이스를 읽고 백엔드 API, 프론트 연동, 테스트, 문서를 함께 수정했습니다."
      },
      {
        "type": "skill",
        "name": "career-mission-design",
        "purpose": "Career Mission AI 화면의 카드, 검색 결과, 업로드 UI가 기존 디자인 시스템과 맞도록 조정했습니다."
      },
      {
        "type": "skill",
        "name": "career-mission-tdd-validator",
        "purpose": "작은 기능 단위로 테스트를 먼저 작성하고 단위/통합 검증 흐름을 점검했습니다."
      }
    ],
    "workflows": [
      {
        "name": "기능 구현 Workflow",
        "steps": [
          "기존 화면과 서비스 코드 조사",
          "백엔드 API와 서비스 함수 구현",
          "프론트 API 헬퍼와 화면 연동",
          "문서와 체크리스트 갱신",
          "단위 테스트와 빌드 실행"
        ]
      },
      {
        "name": "제출 피드백 Workflow",
        "steps": [
          "사용자가 미션 결과물 업로드",
          "백엔드가 링크와 파일 근거 수집",
          "OpenAI가 제출 내용 기반 피드백 생성",
          "DB에 피드백 저장",
          "포트폴리오 초안 생성"
        ]
      }
    ]
  }
}
