{
  "schemaVersion": 1,
  "title": "언코 — 맥락훈련 앱",
  "summary": "AI가 출제한 소설·뉴스를 읽고 핵심을 한 줄로 요약하는 게임형 한국어 학습 앱. 레벨·XP·스트릭·배지로 진행도를 시각화합니다.",
  "githubUser": "zer8m",
  "demoUrl": "https://uncoach-pi.vercel.app",
  "thumbnail": "",
  "screenshots": [],
  "problem": "한국어 학습자는 '어휘는 알지만 실제 맥락에서 어떻게 쓸까?', '긴 글을 읽으면 핵심이 뭘까?'라는 의문을 반복해도 피드백이 느리고 단편적입니다. 모든 상황을 직접 체험할 수 없고, 게임처럼 재미있게 훈련할 방법도 부족합니다.",
  "targetUsers": [
    "한국어를 공부하는 학습자(특히 고급 학습자)",
    "한국 문화권 뉴스·소설을 이해하고 싶은 외국인",
    "맥락 이해 능력을 자신감 있게 키우고 싶은 사람"
  ],
  "features": [
    "고전소설·최신뉴스 지문을 읽고 한 줄 핵심 요약을 작성합니다.",
    "AI(Gemini)가 요약을 채점하고 '대인 맥락 이해도', '정보 등록 정확도', '전략적 사고' 세 축으로 피드백합니다.",
    "매 세션 완료 시 XP를 획득하고, 레벨·스트릭·배지(완벽주의자, 숙련자, 일주일 연속 등)로 동기부여합니다.",
    "모든 진도는 로컬스토리지와 Supabase 데이터베이스에 동시 저장되어 기기 간 동기화됩니다.",
    "사용자가 직접 상황 카드를 만들고 AI 평가를 받을 수 있습니다."
  ],
  "featureTags": [
    "맥락이해",
    "요약훈련",
    "AI채점",
    "게이미피케이션",
    "한국어학습"
  ],
  "techStack": [
    "React 19",
    "Next.js 16.2 (App Router)",
    "TypeScript",
    "Tailwind CSS 4",
    "Supabase (PostgreSQL)",
    "Gemini API",
    "vitest"
  ],
  "techHighlights": [
    "Next.js SPA 구조: 8개 화면을 단일 페이지에서 상태 전환으로 구현. 모든 상태를 `app_state` 테이블에 JSON blob으로 저장해 완전 동기화합니다.",
    "게이미피케이션 파생 계산: history/assets 배열에서 XP·레벨·스트릭·배지를 실시간으로 유도. 별도 저장소 없이 순수 함수로 구현하고 TDD(RED→GREEN→REFACTOR)로 검증했습니다.",
    "경계 검증(SDD): `PUT /api/state`로 들어오는 신뢰불가 입력을 `sanitizeBlob`으로 정규화해 구조적 무결성을 보장. 86개 테스트(blob/gamification/scoring)가 모두 통과합니다."
  ],
  "developmentWithAI": "저는 앱 기능과 데이터 스키마를 정했습니다. Claude AI는 프로토타입 화면 구조 제안, TDD 패턴(테스트 먼저 작성 후 구현), SDD 경계검증 설계를 제시했습니다. 저는 모든 결과를 실행하고 배포했으며, 라이브 환경에서 테스트하고 Vercel 자동 배포를 확인했습니다.",
  "agent": {
    "summary": "기획부터 TDD/SDD 구현, 테스트, 배포까지 Claude AI Agent와 함께 협력했습니다. Agent는 계획 수립, 코드 구현, 테스트 작성, 검증을 담당했고, 저는 요구사항 정의와 최종 승인을 했습니다.",
    "agentTools": [
      {
        "type": "agent",
        "name": "게이미피케이션 설계 Agent",
        "purpose": "TDD 방식으로 sessionsThisWeek·daysSinceLastSession·homeNudge 함수와 perfect-3 배지를 구현했습니다."
      },
      {
        "type": "agent",
        "name": "경계검증(SDD) Agent",
        "purpose": "sanitizeBlob을 스펙 먼저 설계한 후 구현하고, 7개 SDD 테스트로 신뢰불가 입력 정규화를 검증했습니다."
      },
      {
        "type": "skill",
        "name": "test-driven-development",
        "purpose": "RED→GREEN→REFACTOR 사이클을 엄격하게 따라 새 로직마다 먼저 실패하는 테스트를 작성하고, 최소 코드로 통과시킨 후 정리했습니다."
      },
      {
        "type": "skill",
        "name": "verification-before-completion",
        "purpose": "tsc·vitest·build·E2E 검증을 커밋 전에 모두 통과시켜 안정성을 보증했습니다."
      }
    ],
    "workflows": [
      {
        "name": "기능개발 Workflow",
        "steps": [
          "요구사항 분석 (사용자 맥락)",
          "TDD: 실패하는 테스트 작성",
          "최소 구현으로 테스트 통과",
          "코드 정리(리팩터)",
          "tsc·eslint·vitest 검증",
          "프로덕션 빌드 확인",
          "Vercel 배포"
        ]
      },
      {
        "name": "경계검증 Workflow",
        "steps": [
          "SDD: 스펙 먼저 설계 (신뢰불가 입력 → 유효 구조)",
          "7개 경계 케이스 테스트 작성",
          "sanitizeBlob 최소 구현",
          "라우트에 연결 (PUT /api/state)",
          "모든 테스트 통과 확인"
        ]
      }
    ]
  }
}
